315,Bãi Tuy Hòa,"Bãi biển trung tâm thành phố, thuận tiện cho du khách.",Phú Yên,"Biển, Địa điểm tham quan miễn phí",https://maps.app.goo.gl/qAz5EVm8R6Nae9Z89,1L7hwTn676XoO9VQsIgn6hdmNfsoW5Vsm,
316,Tháp Nghinh Phong,"Biểu tượng mới của thành phố Tuy Hòa, với kiến trúc độc đáo.",Phú Yên,"Công trình kiến trúc, Tượng đài, Địa điểm chụp ảnh đẹp",https://maps.app.goo.gl/JbNu3kdmvp7tiniz8,1Tjj5-ip2JVo1BZA-jL5Ik40c34QHfwJx,
317,Chùa Bảo Lâm,Ngôi chùa cổ kính với kiến trúc truyền thống và không gian yên bình.,Phú Yên,"Chùa, Đền, Điểm tham quan miễn phí",https://maps.app.goo.gl/qQK1Uns26deaKKwy6,1bK56SFVqC646_D6xYnAFAcbR2YBbbnXn,
318,Chùa Hương Tích,"Chùa nằm trên núi, có cảnh quan đẹp và không khí trong lành.",Phú Yên,"Chùa, Đền, Thiên nhiên, Điểm ngắm cảnh tự nhiên",https://maps.app.goo.gl/hYBRySkAs8LbX6Wb7,18KV9kUFNLuHj408UrZ7FLeNY1etBkhGM,
319,Làng nghề làm muối Tuyết Diêm,Làng nghề sản xuất muối truyền thống với quy trình độc đáo.,Phú Yên,"Làng nghề truyền thống, Địa điểm tham quan miễn phí",https://maps.app.goo.gl/W7mSAtTD4oMEVoav9,1WHOThtww4zjFBQXKnEQ2ohI6QQPp743_,
320,Cao nguyên Vân Hòa,"Nơi có khí hậu mát mẻ quanh năm, thích hợp cho nghỉ dưỡng và khám phá.",Phú Yên,"Núi, Đi bộ đường dài, Đi xe đạp tham quan, Du lịch sinh thái",https://maps.app.goo.gl/by4dLP12VDBKYvri7,1doOaiKva-isGBfkK_lfVhV4MiQ6BnBNB,
321,Suối Lạnh,"Suối nước mát lạnh, thích hợp cho dã ngoại và tắm suối.",Phú Yên,"Suối, Cắm trại, Đi bộ đường dài",https://maps.app.goo.gl/fcDqKwE6D2mQ2E3V7,19SDBZ3UBob0Ah1bB61lm1o1lQCmr7FUR,
322,Hồ Hóc Răm,"Hồ nước tự nhiên với cảnh quan yên bình, thích hợp cho câu cá và dã ngoại.",Phú Yên,"Hồ, Cắm trại, Picnic, Đi bộ đường dài",https://maps.app.goo.gl/JcAdCP25mUebGgqk9,1YIFhtWcX0ISLzRwts1dPKMsv3xtOaNjn,
344,Lululola Show,"Đây là nơi hội tụ của những tâm hồn yêu nghệ thuật, nơi bạn có thể thả mình vào không gian trữ tình và thưởng thức những giai điệu du dương giữa tiết trời Đà Lạt se lạnh.",Lâm Đồng,Quán cà phê,https://maps.app.goo.gl/EygAQcjF6yPJacHt6,1pdeK2xrsydePPWtMHlS25D6-ThjTdV3N,
345,Cao Nguyên Hoa,"Với khung cảnh thiên nhiên hùng vĩ và không khí bí ẩn, đây không chỉ là địa điểm thu hút đông đảo du khách, đặc biệt là vào những ngày cuối tuần.",Lâm Đồng,"Công viên, đồi, địa điểm chụp ảnh đẹp",https://maps.app.goo.gl/59zve8mbFzzH3LaG8,119VApAAGG3r6mRMHR4iEXHSsNC6CA4Lb,
346,Fresh Garden - Làng Hoa Vạn Thành Đà Lạt,"Có thể nói Fresh Garden Đà Lạt chính là “thiên đường hoa trong xứ sở vạn hoa”. Toạ lạc trong Làng Hoa Vạn Thành Đà Lạt, Fresh Garden mở ra không gian đầy màu sắc của những loài hoa nổi tiếng.",Lâm Đồng,"Công viên, đồi, địa điểm chụp ảnh đẹp",https://maps.app.goo.gl/fF7dkZuGuSJjptUt6,1diw9w3DDejNycP1j6Ud2s352AYWXRdhP,
347,Vườn Thú ZooDoo,"Một địa điểm cực kỳ thu hút trong thời gian gần đây, chính là vườn thú ZooDoo Đà Lạt – mô hình quán cà phê kết hợp với vườn thú mở rất độc đáo. Gian nhà chính của ZooDoo được bao quanh bởi rừng thông tươi mát và yên tĩnh.",Lâm Đồng,"Công viên, địa điểm chụp ảnh đẹp",https://maps.app.goo.gl/tMZcLBHMnFZtN95t5,1PNQ_uwVttBCSD3vT2pcXe_y19XIqoVQZ,
348,Vườn Ánh Sáng Lumiere,"Lumiere Đà Lạt, một địa điểm mới khai trương tại Đà Lạt và đang gây bão mạng xã hội hiện nay. Vườn Ánh Sáng là một không gian triển lãm ánh sáng nghệ thuật, đưa ứng dụng công nghệ bậc nhất Việt Nam vào những màn trình chiếu cực kỳ ấn tượng.",Lâm Đồng,"Công viên, địa điểm chụp ảnh đẹp",https://maps.app.goo.gl/DrNU4Tca9t6bP9cNA,1HU17F3dEF40zsxudK-Ig-QCI-dGNItc2,
349,Đồi Robin Đà Lạt,"Đồi Robin còn được gọi là Khu du lịch cáp treo Đà Lạt, với tuyến cáp treo dài hơn 2km từ đồi Robin tới Thiền Viện Trúc Lâm.",Lâm Đồng,"Đồi, địa điểm chụp ảnh đẹp",https://maps.app.goo.gl/D9dGv2bansbX2Siz6,1ETff3WiKeAKZkVC-Wz-eoaaixkDRvlce,
350,Bảo Tàng & Vườn Madame De Dalat,"Tọa lạc tại trung tâm thành phố Đà Lạt, Bảo tàng & Vườn Madame De Dalat là một điểm đến không thể bỏ qua cho những ai yêu thích lịch sử và kiến trúc.",Lâm Đồng,Bảo tàng,https://maps.app.goo.gl/Hfp2aQPH4tgrn88S9,1unOhb_jZLDu18YCMamZQaGQLbV7R68xF,
351,Khu Du Lịch Rừng Thông Núi Voi Ở Đà Lạt,"Không chỉ là thiên đường sinh thái với thác nước 7 tầng, những cây cổ thụ kỳ vĩ và hàng ngàn bông hoa rực rỡ, nơi đây còn mang đến cơ hội khám phá văn hóa đặc sắc của Tây Nguyên và các quốc gia châu Á.",Lâm Đồng,"Thiên nhiên, núi",https://maps.app.goo.gl/rMd6B2SQDN2y8VUf8,1tKI398d2_0y0tcEG9EM-t7mo7SCEEfnr,
352,Hồ Tuyền Lâm,"Hồ Tuyền Lâm, nằm cách trung tâm thành phố Đà Lạt khoảng 7km, là một trong những điểm đến không thể bỏ lỡ khi bạn ghé thăm thành phố sương mù. Với diện tích rộng lớn khoảng 320 ha, hồ được bao quanh bởi rừng thông xanh bạt ngàn và những ngọn đồi thoai thoải, tạo nên một khung cảnh thiên nhiên thơ mộng và hữu tình.",Lâm Đồng,Hồ,https://maps.app.goo.gl/jYRLnwdkjohrGvDV6,1kePz2b_pOnWZP2Dl53OHA6oS5_Z9KQI3,
353,Hồ Xuân Hương,"Bất cứ ai khi đến trung tâm Đà Lạt đều cũng ngỡ ngàng trước vẻ đẹp của hồ Xuân Hương – viên ngọc xanh của thành phố – với hàng thông, những khóm hoa, bãi cỏ xanh mướt, giúp tô điểm thêm cho vẻ lãng mạn của nơi này.",Lâm Đồng,Hồ,https://maps.app.goo.gl/cJerpK8KPPb5J3YT7,1QCl8ks4cn5AZqUhH3V6MC-laPD4heQsD,
354,Đường Hầm Điêu Khắc Đà Lạt,"Một trong những điểm tham quan nổi tiếng Đà Lạt đó là Đường hầm điêu khắc, hay còn được gọi là Đường hầm đất sét, hoặc Làng đất sét. Đường hầm điêu khắc Đà Lạt là đường hầm dài nhất thế giới được làm bằng đất sét, nổi bật với những tác phẩm miêu tả thiên nhiên, con người Đà Lạt bằng đất sét đỏ đặc trưng.",Lâm Đồng,Công trình kiến trúc,https://maps.app.goo.gl/eTdEweoVrr95GxMQ9,1MzX9JBRULNcdyjipK4rIlRzL70d60OHw,
355,Vùng Đất Cổ Tích Fairytale Land,Vùng đất cổ tích Fairytale Land – Hầm rượu vang Vĩnh Tiến Đà Lạt là “thánh địa sống ảo” gây sốt trong thời gian gần đây.,Lâm Đồng,"Công viên, địa điểm chụp ảnh đẹp",https://maps.app.goo.gl/6C7EcKRnbYyAYuZj6,1QWLG0xo2msZRpqT5UlfExjOdC-JZPURv,
356,QUE Garden Đà Lạt,"Đến QUE Garden, bạn ngỡ như mình đang ở đất nước mặt trời mọc, với những chậu cây bonsai được chăm sóc và uốn nắn kỹ lưỡng vô cùng đẹp mắt, bên cạnh hồ cá Koi đạt tiêu chuẩn Nhật Bản với hàng ngàn con cá Koi to khỏe.",Lâm Đồng,"Công viên, quán cà phê",https://maps.app.goo.gl/tDncpYsxiaBjXdj77,1Pr7kmrntIFbx31ZvM_0sVlLxNsFjFfc3,
357,Trang Trại Cún Đà Lạt - Puppy Farm Đà Lạt,"Nếu bạn là một ""con sen"" chính hiệu thì Nông trại Cún Puppy Farm Đà Lạt là điểm đến không thể bỏ qua trong chuyến du lịch của bạn.",Lâm Đồng,"Thiên nhiên, công viên, quán cà phê",https://maps.app.goo.gl/gDYXhugbjqshRsEH7,1s7DkketdOTlzLZYpBYsIRyqeLVIWbGyW,
358,Nhà Thờ Domaine De Marie,"Nằm yên bình trên đồi Mai Anh, nhà thờ Domaine de Marie, hay còn được gọi là nhà thờ Mai Anh, là một điểm đến không thể bỏ qua khi đến Đà Lạt.",Lâm Đồng,Nhà thờ,https://maps.app.goo.gl/mrRp3aDnEe5u9TWg7,1EmdKuLzkrRt6BnnoTLKE9jVGWEiaPm1M,
359,Vườn Bí Ngô Khổng Lồ Ở Đà Lạt,"Tại đây, bạn sẽ được chiêm ngưỡng những quả bí ngô ""siêu to khổng lồ"" với trọng lượng lên đến 100kg, một cảnh tượng thật sự ấn tượng.",Lâm Đồng,"Thiên nhiên, công viên",https://maps.app.goo.gl/FooBzSB1cES7Kr8L9,1TmyfURfrq7N7P03Njt2H4FDY-Xf6OqVK,
360,Cổng Trời Bali Green Hills,"Tọa lạc bên trong khu nghỉ dưỡng Greenland 2, Cổng trời Bali Đà Lạt, hay còn được biết đến với tên gọi là Green Hills Đà Lạt là một trong những địa điểm tham quan được các bạn trẻ ưa thích nhất Đà Lạt. Cổng trời Đà Lạt là phiên bản Việt của Cổng trời Bali tại ngôi đền Pura Lempuyang Luhur, Indonesia.",Lâm Đồng,Công trình kiến trúc,https://maps.app.goo.gl/R1YeXzqaXaDnLjki8,1ngg3q_YCmvmBs2iKJ_LQ-1CbVNKe1bhc,
361,Thác Pongour,"Thác Pongour, còn được mệnh danh là ""Nam Thiên Đệ Nhất Thác"", là một tuyệt tác thiên nhiên hoang sơ và hùng vĩ, thu hút đông đảo du khách đến chiêm ngưỡng và khám phá.",Lâm Đồng,"Thiên nhiên, thác",https://maps.app.goo.gl/PquYp46HAjNM9i8c9,1g5Jj-kVeQlvdP81upfZ3mLRmED1JVct6,
362,Đồn Điền Café Mê Linh,"Thường được gọi là đồn điền café Mê Linh, là một quán cà phê có không gian thoáng đãng và yên tĩnh.",Lâm Đồng,"Thiên nhiên, quán cà phê",https://maps.app.goo.gl/u37MjdYSsGHnhX7k9,1-CazzgB4NszRCopWxkVr_Vr3743ndSIO,
363,Tea Resort Prenn – Thác Prenn,"Không chỉ chiêm ngưỡng cảnh đẹp như tranh vẽ, bạn còn có cơ hội tham gia các hoạt động mạo hiểm thú vị, khiến nhịp tim tăng tốc trong không gian đầy thơ mộng.",Lâm Đồng,"Thiên nhiên, thác",https://maps.app.goo.gl/ahmHBi4aYCLSyQ2eA,1CUuvH0HRt7pVOg_qyCHb4jjtENpZayuI,
364,Thác Voi Ở Đà Lạt,"Đến thác Voi, bạn có thể thử sức đi bộ lên đỉnh thác với 145 bậc đá gắn liền vào vách núi hiểm trở trong tiếc thác đổ ầm ầm bên tai.",Lâm Đồng,"Thiên nhiên, thác",https://maps.app.goo.gl/QV1NYYyDZAuLGrVy6,1kERtowbA2X6251VJL-JU1C9XcdbBqtVS,
365,Chuyến Tàu Cổ Đà Lạt - Trại Mát,"Với không gian vintage lãng mạn, bạn sẽ cảm nhận được nét quyến rũ của những chuyến tàu xưa cũ.",Lâm Đồng,Điểm chụp ảnh đẹp,https://maps.app.goo.gl/3P419nkiUCb8F7EG6,1pVbyXzYZHqEQ91hv0OeHUfP7eAXjaVW3,
366,Chợ Đêm Đà Lạt,"Đã từ lâu, chợ đêm Đà Lạt, hay còn được gọi là chợ Âm Phủ, đã trở thành một điểm đến không thể bỏ qua cho bất cứ ai đặt chân đến thành phố sương mù.",Lâm Đồng,Chợ đêm,https://maps.app.goo.gl/CxnUkVnKWYhCQ6v47,1_Fhhd-wBujKaZDBaw-y8yKl2-JwSRyOX,
367,Làng Hoa Vạn Thành - Thành Phố Đà Lạt,"Nói đến hoa, chúng ta không thể không nhắc đến làng hoa Vạn Thành – một làng trồng hoa truyền thống đã làm rạng danh thương hiệu hoa Đà Lạt.",Lâm Đồng,"Thiên nhiên, điểm chụp ảnh đẹp",https://maps.app.goo.gl/xTiWrKN2PCA7ToE18,1Janvlxye3oD8GLNV9J4IgiHV0K2gvsgI,
368,Bảo tàng Trà Long Đỉnh,"Tại đây, bạn sẽ được đắm mình trong câu chuyện hấp dẫn về trà, từ những trang sử vàng son đến quy trình sản xuất hiện đại.",Lâm Đồng,Bảo tàng,https://maps.app.goo.gl/hwYvzuVpycf8yvKS9,14Qv3jynLVCyjuncVwikjxoyU6qSUUqDl,
369,Chùa Linh Phước,"Ghé thăm ngôi chùa lâu đời này, bạn hãy đến khu vực Bảo Tháp Bảy Tầng để khám phá 18 Tầng Địa Ngục và giai thoại Mục Liên Tìm Mẹ; từ đó, hiểu rõ hơn về chữ Hiếu và quan niệm cuộc sống sau cái chết trong Phật Giáo Việt Nam.",Lâm Đồng,Chùa,https://maps.app.goo.gl/cSoHkuYSeBiRARFk8,1_JY43ZPbubBblwfnGyQorgTrcbyv1vzC,
370,Khu Du Lịch Sinh Thái Hoa Sơn Điền Trang,"Tại Hoa Sơn Điền Trang, thiên nhiên thuần xanh của Đà Lạt còn được điểm tô thêm sắc màu độc đáo, bởi những tiểu cảnh sáng tạo, ra đời nhằm mục đích phục vụ đam mê “sống ảo” của du khách.",Lâm Đồng,"Thiên nhiên, công viên, khu vui chơi",https://maps.app.goo.gl/k2eFf9CYbEvxwKS57,1DGip7wbXZZuYEjiA_TZFX7byhZa95fBj,
371,Hiệp Khách Lầu - Đà Lạt,"Từ rừng trúc xanh mát mẻ, con thuyền độc mộc đến chiếc cầu gỗ bắt qua mặt hồ nước yên ả, tất cả đều như đang gợi nhớ về một thế giới võ hiệp huyền ảo mà duy mỹ.",Lâm Đồng,"Công viên, quán cà phê",https://maps.app.goo.gl/Y3ZwchcgHvPHJRnm7,1-d3CcZuNRwM61O_ZeYgR8TKgkdAzLtXL,
372,Lạc Tiên Giới,Lạc Tiên Giới nằm giữa rừng thông xanh tươi tốt; không khí ở đây cũng nhờ đó mà quanh năm mát lành.,Lâm Đồng,"Công viên, quán cà phê",https://maps.app.goo.gl/PaL4oavtPU6MrjdZ6,18w8off8A0xdVSBWLMDogDL4_8bw_bWNj,
373,Khu Vui Chơi Đà Lạt Wonderland,"Tại khu vui chơi tổng hợp đa-zi-năng này, bạn có thể “bật mood” thử thách lòng can đảm với hoạt động chạy xe ATV vượt qua các địa hình khó nhằn ở quãng đường dài 400 mét cùng tốc độ “xẹt điện”.",Lâm Đồng,"Công viên, khu vui chơi",https://maps.app.goo.gl/aUeiAdFmkwa3c3PX6,1aqdS6UUxTMUeR4j0pxYJEXM1O6iKhGVU,
374,Chuồn Chuồn Bistro,"Tại Chuồn Chuồn Bistro Đà Lạt, bạn có thể hoà mình vào lối kiến trúc hiện đại và duy mỹ, bên cạnh những góc check-in “đắc địa” đầy màu sắc như Tháp Vọng Cảnh và Hồ Chuồn Chuồn.",Lâm Đồng,"Thiên nhiên, công viên",https://maps.app.goo.gl/7j9S2mHAXTB9NrC47,1KmbC-Mpoel_g7K10Uzg8mx3nj5dQDf3b,
375,Trang Trại Ong - Bee Garden,"Đây là mô hình du lịch canh nông trải nghiệm thú vị, cho phép #teamKlook thăm thú cũng như trải nghiệm thực tế quy trình lấy mật ong, phấn hoa và sữa ong chúa.",Lâm Đồng,"Thiên nhiên, công viên",https://maps.app.goo.gl/hcudq4sUXrYPt6w99,1bfnPf0kIfvANiiPkSEmberrUBHHBQ41m,
635,Check-in cầu treo Kon Klor,"Cây cầu này nối liền hai bờ sông Đăk bla huyền thoại có chiều dài khoảng 292m, phần khung có màu vàng rực rỡ còn phần lan can cầu có màu đỏ nổi bật in mình trong khung cảnh non sông êm ả. Đến đây, bạn có thể thỏa sức check in những bức ảnh tuyệt đẹp và ngắm nhìn vẻ đẹp thiên nhiên gần gũi và thân thương.",KonTum,Thiên nhiên,https://maps.app.goo.gl/Ea4qW4fdyP3PR45k6,1EDWLr0mCD0KIDcKIiwopwq2sm_X8Vrpj,
636,Sông Đăk Bla,"Nhìn từ xa, dòng sông Đăk Bla như một dải lụa khổng lồ xanh biếc, uốn lượn mềm mại bao quanh thành phố Kon Tum trù phú. Không những thế, đây còn là dòng sông chảy ngược (Đông - Tây), với hai bên bờ là những vách đá dựng đứng đầy kỳ vĩ; hòa lẫn trong khung cảnh yên ả của những bản làng vùng ven sông. Tất cả tạo nên nét đặc trưng và vẻ đẹp độc đáo cho nơi đây.",KonTum,"Thiên nhiên, sông",https://maps.app.goo.gl/XxCCxDQR57945Vh37,1RIOnI97TVVcOPYDdqJa_O466cuZ9M24r,
637,Nhà rông Kon Klor,"Nhà rông Kon Klor là địa điểm vui chơi Kon Tum nổi tiếng được du khách lựa chọn khi đến với “Phố Núi Kon Tum”. Kon Klor có chiều dài 17m, rộng 6m và chiều cao nóc nhà là 22m được xây dựng theo nhà truyền thống Tây Nguyên từ vật liệu như tre, nứa, lá, tranh kết hợp khéo léo với trụ gỗ chạm khắc tỉ mỉ cùng nhiều họa tiết thổ cẩm tinh tế.",KonTum,Công trình kiến trúc,https://maps.app.goo.gl/EBSPxHR1E8vXbJUW9,10_Q1aNpRPVs-h1fqTaFwS4_w4zy_RGFE,
638,Thác Pa Sỹ,"Thác Pa Sỹ là dòng thác được hình thành từ ba con suối lớn nhất ở Măng Đen, chảy từ độ cao 1500m xuống vách đá thẳng đứng tạo nên những bọt nước trắng xóa đầy ảo diệu. Đặc biệt bao quanh dòng thác này là cánh rừng xanh tốt, bên dưới là dòng nước xanh trong, cho bạn cảm giác thoải mái và đắm chìm trong khung cảnh thiên nhiên tuyệt đẹp.",KonTum,"Thiên nhiên, thác",https://maps.app.goo.gl/ELqX5nY3ZVptRNqj9,1_rIcTE5XgANWLZrOppOOuU58Mnd_q4t4,
639,Ngục Kon Tum,"Đến với khu di tích lịch sử Ngục Kon Tum, bạn sẽ được tham quan và tìm hiểu quần thể gồm nhà truyền thống, nhà tưởng niệm, nhà đón tiếp, tượng đài bất khuất và hai ngôi mộ tập thể nằm trên bờ sông Đăk Bla hùng vĩ. Ngục Kon Tum không chỉ là nơi tưởng niệm linh thiêng dành cho các anh hùng, mà còn là bảo tàng tổng hợp của tỉnh với nhiều khu trưng bày khác nhau giúp du khách hiểu thêm về nét đẹp của vùng đất này.",KonTum,Công trình kiến trúc,https://maps.app.goo.gl/TYC3BnNVvMg751te9,1W3w4bFsOi8X1GyQ65hqi_p82SkX7wrSD,
640,Ngã ba Đông Dương,"Từ nơi đây phóng tầm mắt ra xa, bạn sẽ nhìn thấy ngọn đồi bao phủ bởi thảm thực vật xanh tốt nhấp nhô trên nền trời xanh tạo nên bức tranh thiên nhiên hoành tráng khiến du khách phải say đắm.",KonTum,"Thiên nhiên, đồi",https://maps.app.goo.gl/rtJrhKX2oH2wHStF9,1NfLVUhH-OtEHgEEqVXCXuZnFrmHp8i-J,
641,Chùa Bác Ái,"Qua nhiều lần trùng tu, hiện chùa Bác Ái còn lưu giữ một vài hiện vật cổ quý hiếm như tượng Quan Âm, tượng Tam Tòa Thánh Mẫu được làm từ gốm men rạn, câu đối do vua Bảo Đại ban tặng, hộp sắc phong “Sắc tứ Bác Ái tự”, bửu ấn,..",KonTum,Chùa,https://maps.app.goo.gl/fb4FwEsCD4Z2Qu3H8,16lu6mHYMdcQLIVgh7PHkSGqMHPM2uBpF,
642,nhà thờ gỗ Kon Tum,"Nhà thờ gỗ Kon Tum thu hút bao du khách bởi sở hữu nét đẹp kiến trúc kết hợp giữa Roma và nhà sàn Bana đầy tinh tế, công phu. Nơi đây xây dựng hoàn thành vào năm 1918 với vật liệu chủ yếu là gỗ cà chít quý hiếm, tường được làm bằng đất trộn rơm, các cửa kính, họa tiết được chạm nổi tỉ mỉ, tinh tế tạo nên vẻ đẹp cuốn hút vượt thời gian.",KonTum,Nhà thờ,https://maps.app.goo.gl/eWtQYSybsM447dC26,1JF9qq2KKrfYvSW846VZkLSGw_5KF6OM5,
643,rừng thông Măng Đen,"Nơi đây nằm ở độ cao khoảng 1200m so với mực nước biển có không khí trong lành, mát mẻ quanh năm, cùng với đó là sự trù phú của hệ sinh thái đa dạng. Khi vượt qua cung đường đèo quanh co, uốn lượn với hai bên đường là những dãy núi trùng điệp, rừng thông xanh mướt trải dài trên nền trời xanh trong, hứa hẹn cho bạn tận hưởng cảm giác thư giãn tuyệt vời hiếm có.",KonTum,"Thiên nhiên, rừng",https://maps.app.goo.gl/QXDU8JLaR4ZYnap66,1vOLFA5IBvv3hIcd9Fkl3IxFoK6U3y5Y3,
644,vườn quốc gia Chư Mom Ray,"Khi đến đây, bạn có thể tham gia tour trekking để chiêm ngưỡng vẻ đẹp thiên nhiên hoang sơ, ngắm nhìn nhiều loại gỗ quý hiếm (có 114 loài trong sách đỏ), đồng thời lắng nghe âm thanh của chim muông để có một ngày trải nghiệm trọn vẹn và thú vị.",KonTum,Vườn quốc gia,https://maps.app.goo.gl/FwGz7ZQie4NxCDHn8,1lOTOtYLtfZOmpggeM2dUQcX1RYAd8HyY,
645,Chủng viện Thừa Sai Kon Tum,"Chủng viện Thừa Sai Kon Tum (hay còn gọi là tòa giám mục), được xây dựng vào năm 1935 có thiết kế khá tương đồng với nhà thờ gỗ Kon Tum. Bởi nơi đây được xây bằng gỗ chít và kết hợp hài hòa giữa kiến trúc châu Âu lẫn dân tộc bản địa.",KonTum,Công trình kiến trúc,https://maps.app.goo.gl/2RW7jKBG7tXt6dv69,1jLbmJdMmUsNh8HtogTHBAk9EZJeqdGkp,
646,núi Ngọc Linh,"Núi Ngọc Linh là ngọn núi có độ cao khoảng 2.600m, nơi có loại sâm quý hiếm thuộc một phần của dãy Trường Sơn Nam huyền thoại. Đây là địa điểm đẹp ở Kon Tum thích hợp cho những tín đồ yêu thích leo núi và khám phá vẻ đẹp thiên nhiên hùng vĩ. Từ trên dãy núi Ngọc Linh, bạn sẽ được chiêm ngưỡng khung cảnh núi non trùng điệp ẩn hiện dưới làn sương mờ ảo đầy thơ mộng.",KonTum,"Thiên nhiên, núi",https://maps.app.goo.gl/BJZFMyR6dMLCqqNm7,1hyBxzbtm6jjnUGwvAFO_PVuTNYGD8Hsl,
647,Hồ T’Nưng,"Hồ T’Nưng nổi tiếng được mọi người biết đến qua câu hát: “Không dám nhìn vào đôi mắt ấy…Đôi mắt Pleiku Biển Hồ đầy”. Đúng vậy, Biển Hồ ở đây chính là tên gọi khác của hồ T’Nưng – một trong những hồ tự nhiên đẹp nhất tỉnh Gia Lai.",Gia Lai,"Thiên nhiên, hồ",https://maps.app.goo.gl/KhYguohTDNY5amQM9,1JR1qNhPRIyFM0eJyQuDk5YR-N3kqZidA,
648,Nhà máy thủy điện Ialy,"Nhà máy thủy điện Ialy là một trong những địa điểm du lịch Gia Lai nằm trong hệ thống thủy điện trên sông Sesan thuộc tỉnh Gia Lai. Đây là công trình thủy điện lớn thứ 2 ở nước ta, chỉ sau thủy điện Sông Đà. Với công suất 720 MW, thủy điện Ialy cung cấp 3.650 triệu KWh điện mỗi năm cho toàn Tây Nguyên.",Gia Lai,Công trình kiến trúc,https://maps.app.goo.gl/3VJyBLFszr7u7Sk78,1vECMLRxwHsNe6XVKXJ7AzRo7GMeHYnk2,
649,Quảng trường Đại Đoàn Kết,"Mỗi quảng trường điểm du lịch Gia Lai lại gắn với lịch sử phát triển cũng linh hồn của một thành phố, và quảng trường Đại Đoàn Kết được mệnh danh là trái tim của người dân Pleiku.",Gia Lai,Công trình kiến trúc,https://maps.app.goo.gl/bpdYZs6DdhetFXjf9,1qwhutIbMch_8UklLCvvMHhpvL0Bh9G3M,
650,Thác Phú Cường,"Nằm cách thị trấn Chư Sê khoảng chừng 3km và nằm cách trung tâm Pleiku 45km đi về hướng đông nam, thác Phú Cường là một khu du lịch sinh thái vô cùng hứa hẹn cho du khách khám phá, những vẻ đẹp thơ mộng bình yên đến diệu kỳ cùng với sức hút lan tỏa rộng lớn đã làm cho không ít người cảm thấy vẻ choáng ngợp của ngọn thác nơi này.",Gia Lai,Thác,https://maps.app.goo.gl/jeGwwuZfeSwhBUZA7,1YubUN-C0Geh_Qq4K6BHA-LGQmuy3_VkR,
651,Đồng xanh,"Được ví như là một cánh đồng rộng lớn được bao phủ những màu xanh cây cỏ tươi tốt, Đồng Xanh Gia Lai đang chứa đựng rất nhiều nét độc đáo của một cánh đồng bao la bát ngát, từ một vùng đất mang một nét thôn quê mộc mạc, hình ảnh cánh đồng xanh đã gắn liền với đồng bào tại đây như là một nét văn hóa truyền thống mộc mạc giản đơn, những kiến trúc độc và lạ đang ngày ngày soi chiếu sẽ tạo nên một bức tranh cảnh mặc sâu sắc.",Gia Lai,"Thiên nhiên, địa điểm chụp ảnh đẹp",https://maps.app.goo.gl/R3aAFQb1fLsyMxydA,1tT_H1_9B5iA0pThGhWBQJx1p8jlxPgWE,
652,Hố Trời,"Tên gọi này có lẽ đã quá quen thuộc với rất nhiều khách du lịch vào mỗi dịp đi du lịch ở Gia Lai, nhờ vẻ bình yên của Hố Trời mà dù cho bất kỳ ai lần đầu được trải nghiệm cũng sẽ cảm nhận được điều độc đáo đặc biệt nhất mà nó mang đến đã vượt xa sự mong đợi cho tất cả mọi người.",Gia Lai,Hồ,https://maps.app.goo.gl/uQrF4vo18UXaFSiG8,1_q0lyp7ppZMJq5icGHz6Q0e6fe9gpkdh,
653,Biển Hồ Chè,"Không chỉ mang một vẻ tuyệt mỹ của những cánh đông chè đến khó quên mà địa điểm du lịch Biển Hồ Chè còn là sự lựa chọn rất thích hợp cho những ai đi du lịch về vùng đất mộng mơ này, những nét bình yên đến kinh ngạc hay các khung cảnh hùng vĩ của Biển Hồ Chè sẽ làm cho rất nhiều người cảm thấy thật sự ấn tượng.",Gia Lai,Núi,https://maps.app.goo.gl/7siJcY5qR6dYukRc7,1I6oO-wQZBUyxXMD6dy2G6fQ2Lm_xZiWI,
654,Núi lửa Chư Đăng Ya,"Nằm ở vị trí khá xa (khoảng 30km) so với trung tâm thành phố Gia Lai, ngọn núi lửa mang tên Chư Đăng Ya là một địa điểm vô cùng độc đáo ấn chứa nhiều nét thơ mộng khó phai mờ cho những ai đi du lịch tại đây, vẻ bình yên cùng với khung cảnh thơ mộng đầy quyễn rũ sẽ làm cho rất nhiều người cảm thấy nơi này thực sự níu kéo họ cũng chính vẻ đẹp mà thiên nhiên đã ban tặng.",Gia Lai,Hồ,https://maps.app.goo.gl/VyTgp7T7GMofbZaa6,1JOfHJSt6vAPLbSO_C0Nez9bh91kGXXJR,
655,Hồ Thác Bà,"Hồ Thác Bà là sự hội tụ của một đập thủy điện mang tên Thác Bà vốn đã rất quen thuộc, từ những vẻ đẹp gần gũi thân thiện, khung cảnh của hồ Thác Bà luôn được đông đảo mọi người yêu thích và muốn khám phá về vùng đất bình yên độc đáo và nhiều thơ mộng.",Gia Lai,"Thiên nhiên, hồ",https://maps.app.goo.gl/VyTgp7T7GMofbZaa6,1va39f1n0qGasOfBPmctH8rNOky4Y98or,
